{"schema_version":"1.0","plan_version":"1.4.0","catalog_version":"2.0.0","task_id":"TASK-BOOT-005","phase":"BOOT","status":"blocked","previous_status":"in_progress","transition_seq":18,"previous_record_sha256":"f4d27a590ec0dcc77d77589a007c103b38827a47d0a5a17a52efa4323bd82dae","catalog_sha256":"622356b355a8cc4fb3a4f5a2bce03bed45bac6a9a3138e42d9852df9b6df6853","git_object_format":"sha1","phase_base_oid":"142abfc339f003ede8d85d9534336923b5610252","head_oid":"ef8bf4b3993bb7612d9823ff2b55b6e470cf47fd","owner_alias":"Platform+Data","owner_role":"Data","actor_id":"codex-local-implementation","actor_role":"Engineering","reviewer_independent":false,"updated_at":"2026-07-31T19:40:08.9044194+08:00","evidence_sha256":"d318145cd5f5d7427d8cd81ba435460c5e0686e2f447f8b03186b6e815191dbd","evidence_paths":["docs/execution/evidence/boot/BOOT-005/gate-results.json"],"blocker_path":"docs/execution/evidence/boot/BOOT-005/blocker.json","decision_reference":null,"transition_reason":"task-gate:blocked"}