{"schema_version":"1.0","plan_version":"1.4.0","catalog_version":"2.0.0","task_id":"TASK-P04-003","phase":"Phase 4","status":"ready_for_review","previous_status":"in_progress","transition_seq":2,"previous_record_sha256":"b990297ba8cc5b25fa1671381bbf9b123ed61baed87f4cc544dfba26bb9ddcbe","catalog_sha256":"622356b355a8cc4fb3a4f5a2bce03bed45bac6a9a3138e42d9852df9b6df6853","git_object_format":"sha1","phase_base_oid":"41194ca7e67ca87fc9cc71ec1c76fcbdbc601818","head_oid":"18d00700d8770e61cafc8abcf038849ba5021ada","owner_alias":"Architecture","owner_role":"Architecture","actor_id":"codex-local-implementation","actor_role":"Engineering","reviewer_independent":false,"updated_at":"2026-08-01T09:01:57.8349638+08:00","evidence_sha256":"c6afe3d0b367c2d9f748968a94d65472451938a5bb9a1de723baa32ab6da8355","evidence_paths":["docs/execution/evidence/phase-04/P04-003/gate-results.json"],"blocker_path":null,"decision_reference":null,"transition_reason":"task-gate:evidence-refresh-without-status-transition"}