{"schema_version":"1.0","plan_version":"1.4.0","catalog_version":"2.0.0","task_id":"TASK-P02-007","phase":"Phase 2","status":"ready_for_review","previous_status":"in_progress","transition_seq":6,"previous_record_sha256":"1f2b75acb076675a4bdd620d662aba9be260b970a0ef83094f7328bc43a72623","catalog_sha256":"622356b355a8cc4fb3a4f5a2bce03bed45bac6a9a3138e42d9852df9b6df6853","git_object_format":"sha1","phase_base_oid":"89ccd30ecda5bbb9bfd6c76b6aa75d153f859f6f","head_oid":"9aef36a566bccdb98676483ed5ec751a0c693e69","owner_alias":"API","owner_role":"Engineering","actor_id":"codex-local-implementation","actor_role":"Engineering","reviewer_independent":false,"updated_at":"2026-08-01T04:11:04.2343960+08:00","evidence_sha256":"f214509a3864d231e9b224c1b0546713dca678bf20848e2913fe94de1fbaf67b","evidence_paths":["docs/execution/evidence/phase-02/P02-007/gate-results.json"],"blocker_path":null,"decision_reference":null,"transition_reason":"task-gate:ready_for_review"}