{"schema_version":"1.0","plan_version":"1.4.0","catalog_version":"2.0.0","task_id":"TASK-P05-006","phase":"Phase 5","status":"ready_for_review","previous_status":"in_progress","transition_seq":2,"previous_record_sha256":"31be325207d6610ed01f65fc7342e5c1493fc4e4821f64afb6f47d23ed6481bc","catalog_sha256":"622356b355a8cc4fb3a4f5a2bce03bed45bac6a9a3138e42d9852df9b6df6853","git_object_format":"sha1","phase_base_oid":"db0dd8dd05e2db8460c01fe4eb73812bcc330263","head_oid":"d1c3c6258713895834ec7faca6c482aa55297f67","owner_alias":"QA","owner_role":"Engineering","actor_id":"codex-local-implementation","actor_role":"Engineering","reviewer_independent":false,"updated_at":"2026-08-01T13:17:02.9751360+08:00","evidence_sha256":"d7c256e12a077c20c86156498f8144e0edf85d86ec7288801ec3b916ecc1db1b","evidence_paths":["docs/execution/evidence/phase-05/P05-006/gate-results.json"],"blocker_path":null,"decision_reference":null,"transition_reason":"task-gate:evidence-refresh-without-status-transition"}