{"schema_version":"1.0","plan_version":"1.4.0","catalog_version":"2.0.0","task_id":"TASK-P09-990","phase":"Phase 9","status":"ready_for_review","previous_status":"in_progress","transition_seq":2,"previous_record_sha256":"c77db14c13f2bcb56e087f551b2c34cf30b451ae805ca224d965d96ea72ecac1","catalog_sha256":"622356b355a8cc4fb3a4f5a2bce03bed45bac6a9a3138e42d9852df9b6df6853","git_object_format":"sha1","phase_base_oid":"04ab40a00e6f8f6567956f0b3a07d5ca5c99a078","head_oid":"f94b28eb26bb3ab096a58057dd0338b196e20788","owner_alias":"Mobile","owner_role":"Engineering","actor_id":"codex-local-implementation","actor_role":"Engineering","reviewer_independent":false,"updated_at":"2026-08-02T03:03:15.7447215+08:00","evidence_sha256":"2916e25f99477b397b0cff744bc1752ec9c446921de7cb30f1a28da47f8df964","evidence_paths":["docs/execution/evidence/phase-09/P09-990/gate-results.json"],"blocker_path":null,"decision_reference":null,"transition_reason":"task-gate:evidence-refresh-without-status-transition"}