{"schema_version":"1.0","plan_version":"1.4.0","catalog_version":"2.0.0","task_id":"TASK-P10-009","phase":"Phase 10","status":"blocked","previous_status":"in_progress","transition_seq":12,"previous_record_sha256":"7b0f2f2d4e8e56b2696f13f6180d0b539fe2905709b27142b485712d26e4bc43","catalog_sha256":"622356b355a8cc4fb3a4f5a2bce03bed45bac6a9a3138e42d9852df9b6df6853","git_object_format":"sha1","phase_base_oid":"ca3eeb27ac823eb425c3498d7eb4584a03806697","head_oid":"bf96ced7d85446abf11c4e39b4a5ace98d9e89b8","owner_alias":"ReleaseEng","owner_role":"Engineering","actor_id":"codex-local-implementation","actor_role":"Engineering","reviewer_independent":false,"updated_at":"2026-08-02T04:53:43.8225571+08:00","evidence_sha256":"9fc4d100d798171a267719bad5cca6c67dafab0ea9a19b281f7aaa4dc3cdd238","evidence_paths":["docs/execution/evidence/phase-10/P10-009/gate-results.json"],"blocker_path":"docs/execution/evidence/phase-10/P10-009/blocker.json","decision_reference":null,"transition_reason":"task-gate:blocked"}