{"schema_version":"1.0","plan_version":"1.4.0","catalog_version":"2.0.0","task_id":"TASK-P02-008","phase":"Phase 2","status":"ready_for_review","previous_status":"in_progress","transition_seq":2,"previous_record_sha256":"4d0d00d6bc350d642050fdf96ec40405cf9b633c82245bdc80327197d310ec93","catalog_sha256":"622356b355a8cc4fb3a4f5a2bce03bed45bac6a9a3138e42d9852df9b6df6853","git_object_format":"sha1","phase_base_oid":"89ccd30ecda5bbb9bfd6c76b6aa75d153f859f6f","head_oid":"034f777a9412f93c6d120d3ded753a8048cde199","owner_alias":"Security","owner_role":"Security","actor_id":"codex-local-implementation","actor_role":"Engineering","reviewer_independent":false,"updated_at":"2026-08-01T04:14:16.7382517+08:00","evidence_sha256":"23bad624593830829f9c53f702e62369b693b4d095769ba1ab9dc926a389e537","evidence_paths":["docs/execution/evidence/phase-02/P02-008/gate-results.json"],"blocker_path":null,"decision_reference":null,"transition_reason":"task-gate:ready_for_review"}