{"schema_version":"1.0","plan_version":"1.4.0","catalog_version":"2.0.0","task_id":"TASK-P00-005","phase":"Phase 0","status":"blocked","previous_status":"in_progress","transition_seq":4,"previous_record_sha256":"b59f008c8540c5b8d5134b1119ecaa887e6b091406c5d5f6b807b6c885635f5c","catalog_sha256":"622356b355a8cc4fb3a4f5a2bce03bed45bac6a9a3138e42d9852df9b6df6853","git_object_format":"sha1","phase_base_oid":"5bf4f853453963ba4f11fa37e98d1be7bb34cf06","head_oid":"7839b5e9b9bdaeca789ec7405be50991d9b098e2","owner_alias":"Engineering","owner_role":"Engineering","actor_id":"codex-local-implementation","actor_role":"Engineering","reviewer_independent":false,"updated_at":"2026-08-01T00:53:49.2568572+08:00","evidence_sha256":"3ef08bb4a5fdc9eca4bf30e6a502041a7122432898881420b20045efafdb9b9b","evidence_paths":["docs/execution/evidence/phase-00/P00-005/gate-results.json"],"blocker_path":"docs/execution/evidence/phase-00/P00-005/blocker.json","decision_reference":null,"transition_reason":"task-gate:blocked"}