{"schema_version":"1.0","plan_version":"1.4.0","catalog_version":"2.0.0","task_id":"TASK-P10-010","phase":"Phase 10","status":"blocked","previous_status":"in_progress","transition_seq":2,"previous_record_sha256":"1d5f05065aeba7200a3e60ebad128e54de0fbeaf58b6bd64d473617b6de14a2f","catalog_sha256":"622356b355a8cc4fb3a4f5a2bce03bed45bac6a9a3138e42d9852df9b6df6853","git_object_format":"sha1","phase_base_oid":"ca3eeb27ac823eb425c3498d7eb4584a03806697","head_oid":"ab1c198a50cc90f5aae618dc389afe011b762f44","owner_alias":"ReleaseBoard","owner_role":"Engineering","actor_id":"codex-local-implementation","actor_role":"Engineering","reviewer_independent":false,"updated_at":"2026-08-02T04:55:20.0873264+08:00","evidence_sha256":"e426784a87bb46cecd3d83189bfffbe97f1619ddd6c979aec3ffc45ec6548e71","evidence_paths":["docs/execution/evidence/phase-10/P10-010/gate-results.json"],"blocker_path":"docs/execution/evidence/phase-10/P10-010/blocker.json","decision_reference":null,"transition_reason":"task-gate:blocked"}