{"schema_version":"1.0","plan_version":"1.4.0","catalog_version":"2.0.0","task_id":"TASK-P09-008","phase":"Phase 9","status":"ready_for_review","previous_status":"in_progress","transition_seq":2,"previous_record_sha256":"8008411fb44c3b1edd620503161910073ffbadfb82aa6b37311f352502aa0976","catalog_sha256":"622356b355a8cc4fb3a4f5a2bce03bed45bac6a9a3138e42d9852df9b6df6853","git_object_format":"sha1","phase_base_oid":"04ab40a00e6f8f6567956f0b3a07d5ca5c99a078","head_oid":"699d8183a86c9349efa01482c7b68ff7d26d8c5e","owner_alias":"QA","owner_role":"Engineering","actor_id":"codex-local-implementation","actor_role":"Engineering","reviewer_independent":false,"updated_at":"2026-08-02T02:11:01.6972058+08:00","evidence_sha256":"92073eb72e03a6b23882e70df838350e172384b6652e87041db0ba408d8d1cef","evidence_paths":["docs/execution/evidence/phase-09/P09-008/gate-results.json"],"blocker_path":null,"decision_reference":null,"transition_reason":"task-gate:ready_for_review"}