{"schema_version":"1.0","plan_version":"1.4.0","catalog_version":"2.0.0","task_id":"TASK-P06-007","phase":"Phase 6","status":"ready_for_review","previous_status":"in_progress","transition_seq":4,"previous_record_sha256":"7cc68d93bef597e595b5b29de65a483588b07fe0baf635c6e14e472dcc335078","catalog_sha256":"622356b355a8cc4fb3a4f5a2bce03bed45bac6a9a3138e42d9852df9b6df6853","git_object_format":"sha1","phase_base_oid":"1b996a2da9cc2abe46242afe3174da21cdd0455e","head_oid":"4ce6fa5fa57c200bfe4e12a5b957e51e51506a3a","owner_alias":"API","owner_role":"Engineering","actor_id":"codex-local-implementation","actor_role":"Engineering","reviewer_independent":false,"updated_at":"2026-08-01T16:27:09.4191164+08:00","evidence_sha256":"896679d9d8a705991944b06ad9b663b0981b1a42fca3bde402e1dcce48ed4540","evidence_paths":["docs/execution/evidence/phase-06/P06-007/gate-results.json"],"blocker_path":null,"decision_reference":null,"transition_reason":"task-gate:evidence-refresh-without-status-transition"}