{"schema_version":"1.0","plan_version":"1.4.0","catalog_version":"2.0.0","task_id":"TASK-P08-001","phase":"Phase 8","status":"in_progress","previous_status":"blocked","transition_seq":3,"previous_record_sha256":"441a0b73520bcc085c4b8a1630e0e7d5297fb273dba972b5d1ec49ad35b64250","catalog_sha256":"622356b355a8cc4fb3a4f5a2bce03bed45bac6a9a3138e42d9852df9b6df6853","git_object_format":"sha1","phase_base_oid":"d8044258e14d65e2db4639328205f969dfddf5e9","head_oid":"d8044258e14d65e2db4639328205f969dfddf5e9","owner_alias":"AgentEng","owner_role":"Engineering","actor_id":"codex-local-implementation","actor_role":"Engineering","reviewer_independent":false,"updated_at":"2026-08-01T19:23:19.6744612+08:00","evidence_sha256":"0000000000000000000000000000000000000000000000000000000000000000","evidence_paths":[],"blocker_path":null,"decision_reference":null,"transition_reason":"task-gate:in_progress"}