{"schema_version":"1.0","plan_version":"1.4.0","catalog_version":"2.0.0","task_id":"TASK-P04-004","phase":"Phase 4","status":"ready_for_review","previous_status":"in_progress","transition_seq":2,"previous_record_sha256":"58537149ac83660d2b76fa10aef72a75a912140498d6a9f04431576d6c3b2c4b","catalog_sha256":"622356b355a8cc4fb3a4f5a2bce03bed45bac6a9a3138e42d9852df9b6df6853","git_object_format":"sha1","phase_base_oid":"41194ca7e67ca87fc9cc71ec1c76fcbdbc601818","head_oid":"d4b1a35b91fcfeafb57f7c3fd3d52e1114035432","owner_alias":"ModelPlatform","owner_role":"Engineering","actor_id":"codex-local-implementation","actor_role":"Engineering","reviewer_independent":false,"updated_at":"2026-08-01T09:26:43.9985066+08:00","evidence_sha256":"882ebb8c1b0cd6b2171b20e0a789b8f854a56275f6b2c2011db22b2b44825284","evidence_paths":["docs/execution/evidence/phase-04/P04-004/gate-results.json"],"blocker_path":null,"decision_reference":null,"transition_reason":"task-gate:evidence-refresh-without-status-transition"}