{"schema_version":"1.0","plan_version":"1.4.0","catalog_version":"2.0.0","task_id":"TASK-P01-001","phase":"Phase 1","status":"ready_for_review","previous_status":"in_progress","transition_seq":5,"previous_record_sha256":"879281c3d8be3f3379100e72ab533bb3032e40e44800ed8886227927d25d581c","catalog_sha256":"622356b355a8cc4fb3a4f5a2bce03bed45bac6a9a3138e42d9852df9b6df6853","git_object_format":"sha1","phase_base_oid":"68d04e230fce0ecf5ecbbded13d8d7ca609d14c9","head_oid":"4cc506db8bf1b725895943bd0731cc0494de1769","owner_alias":"Engineering","owner_role":"Engineering","actor_id":"codex-local-implementation","actor_role":"Engineering","reviewer_independent":false,"updated_at":"2026-08-01T01:41:43.9292362+08:00","evidence_sha256":"64cb27854f3a718bb5fbc6f738a24e056ebe028a8c33f0fcac0c52095f1778e3","evidence_paths":["docs/execution/evidence/phase-01/P01-001/gate-results.json"],"blocker_path":null,"decision_reference":null,"transition_reason":"task-gate:ready_for_review"}