{"schema_version":"1.0","plan_version":"1.4.0","catalog_version":"2.0.0","task_id":"TASK-P04-010","phase":"Phase 4","status":"ready_for_review","previous_status":"in_progress","transition_seq":6,"previous_record_sha256":"2feaf4e675f7f9f4683784ff7a2766753fd65efa4580028ad4c53d45d7169778","catalog_sha256":"622356b355a8cc4fb3a4f5a2bce03bed45bac6a9a3138e42d9852df9b6df6853","git_object_format":"sha1","phase_base_oid":"41194ca7e67ca87fc9cc71ec1c76fcbdbc601818","head_oid":"19c9d86ad516b6f811a4b6797f7e13db15328d50","owner_alias":"Eval","owner_role":"Eval","actor_id":"codex-local-implementation","actor_role":"Engineering","reviewer_independent":false,"updated_at":"2026-08-01T10:10:35.3967719+08:00","evidence_sha256":"f230a82625d8e55d7afcf07468bc81eb0a219669326a66288c3b7f1be8253f40","evidence_paths":["docs/execution/evidence/phase-04/P04-010/gate-results.json"],"blocker_path":null,"decision_reference":null,"transition_reason":"task-gate:evidence-refresh-without-status-transition"}