{"schema_version":"1.0","plan_version":"1.4.0","catalog_version":"2.0.0","task_id":"TASK-P05-005","phase":"Phase 5","status":"ready_for_review","previous_status":"in_progress","transition_seq":2,"previous_record_sha256":"5b5e337d21097ee0478f07cbfa070ba490c7b860773b7c07e2f96101ebe2c116","catalog_sha256":"622356b355a8cc4fb3a4f5a2bce03bed45bac6a9a3138e42d9852df9b6df6853","git_object_format":"sha1","phase_base_oid":"db0dd8dd05e2db8460c01fe4eb73812bcc330263","head_oid":"366d3f29a2aebb6af7b6b8c4ed816b85e63853fa","owner_alias":"Reliability","owner_role":"SRE","actor_id":"codex-local-implementation","actor_role":"Engineering","reviewer_independent":false,"updated_at":"2026-08-01T12:50:10.7033045+08:00","evidence_sha256":"005fb1c15dc34ab758bbdff41a45e017fe40985911703ef0d124c13ef7c3f279","evidence_paths":["docs/execution/evidence/phase-05/P05-005/gate-results.json"],"blocker_path":null,"decision_reference":null,"transition_reason":"task-gate:ready_for_review"}