{"schema_version":"1.0","plan_version":"1.4.0","catalog_version":"2.0.0","task_id":"TASK-P07-002","phase":"Phase 7","status":"ready_for_review","previous_status":"in_progress","transition_seq":2,"previous_record_sha256":"c9ac75a636192ca4bf5635399c98ee354237b1e23ecfac9c59094578c38d42d4","catalog_sha256":"622356b355a8cc4fb3a4f5a2bce03bed45bac6a9a3138e42d9852df9b6df6853","git_object_format":"sha1","phase_base_oid":"627ec10bdb04dcdf732f5dd28f93d8bd07446d42","head_oid":"91d7d945d9be33f5037246726b55031991c1fbab","owner_alias":"DomainEng","owner_role":"Domain","actor_id":"codex-local-implementation","actor_role":"Engineering","reviewer_independent":false,"updated_at":"2026-08-01T17:36:41.8387322+08:00","evidence_sha256":"323a05faab91bf35399609c7086750dba2b79bb0b133d1a0a0d130f8cc20321b","evidence_paths":["docs/execution/evidence/phase-07/P07-002/gate-results.json"],"blocker_path":null,"decision_reference":null,"transition_reason":"task-gate:evidence-refresh-without-status-transition"}