{"schema_version":"1.0","plan_version":"1.4.0","catalog_version":"2.0.0","task_id":"TASK-P07-001","phase":"Phase 7","status":"ready_for_review","previous_status":"in_progress","transition_seq":9,"previous_record_sha256":"23a118e2328727664565c6ea64f7ed7d89c1c22b552ebf790f854453f46ad52e","catalog_sha256":"622356b355a8cc4fb3a4f5a2bce03bed45bac6a9a3138e42d9852df9b6df6853","git_object_format":"sha1","phase_base_oid":"627ec10bdb04dcdf732f5dd28f93d8bd07446d42","head_oid":"8b16577d890161e3db8dbc6625f27cb236c991fb","owner_alias":"Domain","owner_role":"Domain","actor_id":"codex-local-implementation","actor_role":"Engineering","reviewer_independent":false,"updated_at":"2026-08-01T17:26:29.1924397+08:00","evidence_sha256":"ca780bb4dfc1a921a48641029eeb2faa3ac74a1b6cc716d8ef1ebe1c7becbf64","evidence_paths":["docs/execution/evidence/phase-07/P07-001/gate-results.json"],"blocker_path":null,"decision_reference":null,"transition_reason":"task-gate:evidence-refresh-without-status-transition"}