{"schema_version":"1.0","plan_version":"1.4.0","catalog_version":"2.0.0","task_id":"TASK-P10-002","phase":"Phase 10","status":"ready_for_review","previous_status":"in_progress","transition_seq":2,"previous_record_sha256":"793e18bc341a9a92f6b02c9213a1c29556d1f804c5066ed5c40782adcd5e2ed2","catalog_sha256":"622356b355a8cc4fb3a4f5a2bce03bed45bac6a9a3138e42d9852df9b6df6853","git_object_format":"sha1","phase_base_oid":"ca3eeb27ac823eb425c3498d7eb4584a03806697","head_oid":"4a16ec74d5a4c883aa002c652f4312c07ed94f08","owner_alias":"SRE","owner_role":"SRE","actor_id":"codex-local-implementation","actor_role":"Engineering","reviewer_independent":false,"updated_at":"2026-08-02T03:49:48.8442152+08:00","evidence_sha256":"636fc10d4275e7cbffb0e66fbe072ee3ef8e01bbdf104407ff8cc73d31c8fef4","evidence_paths":["docs/execution/evidence/phase-10/P10-002/gate-results.json"],"blocker_path":null,"decision_reference":null,"transition_reason":"task-gate:evidence-refresh-without-status-transition"}