{"schema_version":"1.0","plan_version":"1.4.0","catalog_version":"2.0.0","task_id":"TASK-P03-006","phase":"Phase 3","status":"ready_for_review","previous_status":"in_progress","transition_seq":2,"previous_record_sha256":"cbcf60f333221882354685167030c3577ca60cb257299f3f3209982880c82edc","catalog_sha256":"622356b355a8cc4fb3a4f5a2bce03bed45bac6a9a3138e42d9852df9b6df6853","git_object_format":"sha1","phase_base_oid":"aff2517da3143d539b0d639f9fa3bde6ec192181","head_oid":"79b0706b7a9e5a04fee30febdc6a8670c0ec056f","owner_alias":"Data","owner_role":"Data","actor_id":"codex-local-implementation","actor_role":"Engineering","reviewer_independent":false,"updated_at":"2026-08-01T06:33:37.7597906+08:00","evidence_sha256":"0228e58477af4753ffd0ec93f75c35f99c02cdbd3b2f0c3151aa396619566d7a","evidence_paths":["docs/execution/evidence/phase-03/P03-006/gate-results.json"],"blocker_path":null,"decision_reference":null,"transition_reason":"task-gate:evidence-refresh-without-status-transition"}