{"schema_version":"1.0","plan_version":"1.4.0","catalog_version":"2.0.0","task_id":"TASK-BOOT-003","phase":"BOOT","status":"ready_for_review","previous_status":"in_progress","transition_seq":2,"previous_record_sha256":"1111111111111111111111111111111111111111111111111111111111111111","catalog_sha256":"2222222222222222222222222222222222222222222222222222222222222222","git_object_format":"sha1","phase_base_oid":"142abfc339f003ede8d85d9534336923b5610252","head_oid":"142abfc339f003ede8d85d9534336923b5610252","owner_alias":"Engineering","owner_role":"Engineering","actor_id":"fixture-implementer","actor_role":"Engineering","reviewer_independent":false,"updated_at":"2026-07-31T00:00:00+08:00","evidence_sha256":"3333333333333333333333333333333333333333333333333333333333333333","evidence_paths":["fixture"],"blocker_path":null,"decision_reference":null,"transition_reason":"fixture"}
